<?xml version="1.0" encoding="UTF-8"?>
<users
        xmlns="http://luksha.it-academy.by/xml/users"
        xmlns:xsi="http://www.w3.org/2001/XMLSchema-instance"
        xsi:schemaLocation="http://luksha.it-academy.by/xml/users users.xsd">
    <user>
        <ID>1</ID>
        <Login>Toyota</Login>
        <Password>LC 200</Password>
        <Email>off-road</Email>
        <FK_Role>120</FK_Role>
    </user>
    <user>
        <ID>1</ID>
        <Login>Toyota</Login>
        <Password>LC 200</Password>
        <Email>off-road</Email>
        <FK_Role>120</FK_Role>
    </user>
    <user>
        <ID>1</ID>
        <Login>Toyota</Login>
        <Password>LC 200</Password>
        <Email>off-road</Email>
        <FK_Role>120</FK_Role>
    </user>
</users>